,Date,Title,cp,Sentiment_Score
4233,2023-06-21,sp sector roic fall q ai boom stay sp say wall street firm bumping target goldman strategist see many reason hedging sp rally sp nasdaq rise end day losing streak investor snap tech share live update two world richest men loaded exact stock wall street new consensus ai drive stock market higher history suggests sp dividend stock perfect buy hold forever sp could sink recession consider hedging complete breakdown sp company wall street end lower pausing rally powell testimony loom tesla return sp esg index environmental disclosure ultrawealthy love billion recessionproof industry outperforming sp stock market outlook record high could hit sp end year here investor know stockmarket rally leg even sp slide tech lead stock dip powell point rate hike stock market news today great recession forbes advisor wall street extends selloff powell hint rate hike sp nasdaq price setup powell speech trigger reversal short bet u stock hit trillion since april djia technical broke minor support ahead underperformed best worst performing stock far nasdaq dow jones sp stock retreat investor digest powell inflation comment stock market today dow sp live update june sp fomo rally upside beyond say bank america chart analyst fomo rally stock market upside key risk looming bofa,4365.68994140625,0.9578
4234,2023-06-22,nasdaq dow jones sp investor edge powell hawkish stance put wall street alert recession obsession ai boom wild market wall street expect rest investor preparing coming techstock crash u stock market dow jones sp nasdaq fall jerome powell inflation recession u dollar stock market today dow sp live update june wall street slip powell hint rate hike wall street end higher powell wrap testimony analyst keep raising earnings expectation sp yolo army bet stock fastest pace ever jpmorgan say sp nasdaq snap day losing streak tech stock advance u stock shake ratehike worry end mostly higher sp dow pause powell defends inflation fight top dividend payer sp,4381.89013671875,-0.8271
4235,2023-06-23,stock tumble friday nasdaq snap eightweek winning streak live update long bull market last here historical data dow jones today index fall breaking week winning streak wall st week ahead lofty valuation u stock growing worry investor nasdaq dow jones sp investor brace negative weekly result sp sector pricetoeconomic book value ratio rise q analyst optimistic rating sp company heading q amazon discount retailer shine week sp struggle invest sp invest sp april nasdaq dow jones sp wall street face losing week stock index retreat stock market unlikely sp make money year strategist say fidelity fund quietly beat cathie wood game ftse sp return market bubble ftse back negative territory dax sp come high there still reason believe value investing bofa say investor fleeing tech stock baby bubble global market slide recession fear grip investor byebye bull market top forecaster predicts sp return year inflation next decade wall street end higher powell wrap testimony dog sp strategy performance current pick stock sink nasdaq sp snap lengthy win streak stock market news today stock fall dollar investor weigh rate hike canadian stock payouts hit record level versus u cibc say,4348.330078125,0.8481
4238,2023-06-26,morgan stanley top strategist say stock precipice major plunge nasdaq shed monday investor dump tech name start final week june live update ftse dax sp try find support stock market today dow sp live update june charted company nasdaq weight dow jones nasdaq sp weekly preview tech bull running steam investingcom nasdaq dow jones sp major average end weekly winning streak investor seek momentum wharton jeremy siegel see mild recession year nasdaq dow jones sp fed tightening pfizers drug drop dampen wall street mood wall street gap market outlook grows canyon soon say whether bull market invest anyway wall street slip investor eye russia fed hike quarterend investor ignoring federal reserve warning take zacks approach beat market shopify oracle uber focus invesco sp high dividend low volatility etf sphd investing radar stock slip tech drag start last week june trading stock market news today new standard poor bull market need breather might time get optimistic stock market investor watch quarterend rebalancing u stock bond option anatomy narrow equity market stock market set big first half gain history say rest economic outlook u q sticky slowdown mean higher longer,4328.81982421875,0.5423
4239,2023-06-27,market rise positive news consumer confidence travel demand mustknow etf beat market long term investor mint nearly trillion ai stock gold rush goldman sachs stock expected x sp low risk wall street rebound upbeat economic data allays slowdown fear wall street close higher upbeat economic data allays slowdown fear homebuilder etf outperforms sp industry stock still cheap market rally spyi cross million investor flood sp sp nasdaq future rise slightly investor await economic data stock market today live update nasdaq dow jones sp mixed result walgreens disappoints durable good surge home price vary fundstrats tom lee say buy dip sp here sp rally could continue breathe new life small cap stock strategist superstar stock getting rarer winnertakeall market stock market today dow sp live update june bnp paribas unveils first etf irish platform sp eps estimate remain intact,4378.41015625,0.5302
4240,2023-06-28,general mill gi stock sink cheerio maker forecast slowdown equal weight rsp poised outperform sp june july became best month stock past year here take market rally year goldman sachs say attractive valuation make smallcap stock appealing strong buy name meta top list u firm spending private jet watch sp gain may much lower expected fed economist say cathie wood ark outshines sp nasdaq h major trade made american company draining cash dumbest possible time india stock market hitting record high here equal weight rsp poised outperform sp june ftse dax sp recover sp headed big firsthalf gain three key stock doubled bnp paribas asset management launch first irish etf stock market today dow sp live update june sp nasdaq edge higher apple counter fed jitter nasdaq dow jones sp price slide trade tension mount nvidia decline nasdaq set best first half year history amid aifueled market euphoria forget ai ev cruise line rank among top stock sp sp dow end lower powell reiterates fed could raise rate twice sp company visual breakdown big picture sp close near flat powell warns restrictive policy could way live update dow sp end lower fed powell say backtoback rate hike arent ruled sp v russell small cap outperform goldman sachs say,4376.85986328125,0.9774
4241,2023-06-29,sp end higher treasury yield touch threemonth high solid u economic data dow close point higher major bank pop stress test result gdp revised upward live update nasdaq edge sp dow decline slightly fed rate hike focus dow sp gain bank rally countering rate worry stock market today dow sp live update june oped one saw sp surging first half nasdaq dow jones sp optimism gdp surpasses expectation jobless claim drop default risk broadly tick sp company end june investor pouring money modified sp stockmarket strategy verizon stock upside recovers preinflation shock high double negative sp index coming investing recession much know wall street rally head winning week month first half year stock market news today dow sp rally financials lead tiprankscom,4396.43994140625,0.2732
4242,2023-06-30,stock market rally shocked everyone broadening beyond tech u stock may rally expected year top performing stock sp first half meet index laggard sp six stock turn six month wall st rally nasdaq hit year milestone apple scale trillion artificial intelligence ai boom could send sp higher according wall street u stock dow sp gain bank rally countering rate worry ftse dax sp try end month quarter high biden stock market gain trail trump obama stock market surprising firsthalf strength second half preview expect stock market apple worth trillion boosted nasdaq best start year six question facing u stock investor second half nears moving average sp finish june inflation data propel sp week high trader see detail investor believe new bull market recession cathie wood back top thanks stock sp banking share rally lift dow sp sp rise friday close big first half nasdaq post best start year decade live update,4450.3798828125,0.989
4245,2023-07-03,top stock sp sp nasdaq ahead u job data sign reversal stock market outlook fundstrat raise sp price target ai nifty v sp india catch breadth even u outruns fundstrats tom lee raise sp target see alltime high yearend sp finish year modestly higher invescos hooper here another reason market could post huge rally second half stock market today dow sp live update july russell index definition holding return apple growing stock market heft pose dilemma fund manager dow jones nasdaq sp weekly preview bear back seat,4455.58984375,0.802
4247,2023-07-05,june midyear review outlook broadening horizon deceptive breadth equity rally sp snap threeday win streak u stock close lower wall street post modest loss fed minute stock make rule screen sp v gold better investment sp stock trading discount second half get way u stock broadly rise june sp nasdaq dow jones sp cautious trade ahead fed minute exploiting wonderfully weird overnight drift stock stock market today dow sp live update july jeremy grantham gmo stock market crash likely stock market index sp djia nasdaq ftse dax sp negative footing dow slip point snap day win streak investor consider fed latest comment live update fed cant decide much money u household left dow close point lower hot job data raise fear fed rate hike live update wall street bull see stock higher ai wont driver cost debt repayment rising burden u company etf tap sp best h since rule identify next stock market winner goldman sachs stock end lower amid china headwind fed minute stock market news today valuable u company world market cap nasdaq dow jones sp mixed return holiday break investor await fed minute cramer examines worst performer first half explains market seems narrow stock market news jul,4446.81982421875,0.7724
4248,2023-07-06,wall st slide labor data stokes rate hike fear wall street trader reel stillhot economy fuel ratehike bet wall st log sharp loss labor market strength stokes ratehike fear exactly problem stock index concentration stock market today dow sp live update july bull market stock track push sp outofsync u stock hide market risk equity outlook ai star eclipse broader earnings resilience dow tumble redhot u job market reit stock log positive return q underperform sp nasdaq dow jones sp caution prevails robust job data raise rate hike concern wall street prediction gone wrong expert revise sp target top mostvaluable stock still cheap analyst say dow plunge point investor brace much aggressive fed action top etf satellite etf stock investor notice wall street fear gauge jump sptsx composite almost point u stock also fall titan review need know left behind stockmarket rally use kind etf play catchup sp responded new pvp disclosure rule time buy sp worstperforming stock june best blackrock fund buy ira weekend effect real david rosenberg time deploy profit u stock market tsx,4411.58984375,0.5106
4249,2023-07-07,etf winner h upside left u stockssp dow slip mixed job data stock market short seller helped fuel year rally finally giving industry analyst project increase sp price next month u stock market today update sp nasdaq wall street end choppy day lower job data energy stock jump sp struggle direction heading towards closing bell way grow wealth according selfmade millionaire deceptively simple ftse dax sp taking hit amid strong u adp job data sp bear moving front side bull trend spdr portfolio sp value etf spyv investing radar spx sp drop data show u labor market still hot u stock give gain end lower book weekly loss june job data cruise line stock become top performer job report hiring merely solid wage growth hot u company highest profit margin sp gain weakest pace job growth since eas fed hike worry investingcom nasdaq dow jones sp u stock waver weaker job report fed rate hike worry u stock sink yield soar sp carves bearish doubletop pattern sp edge mixed job data stock including tesla week top performer sp fall stock tumble friday notching weekly loss trader rate hike fear return live update bofa stock indicator see sp surging next month,4398.9501953125,0.6908
4252,2023-07-10,highest number sp company issuing positive eps guidance since q wall st end investor digest fed official comment dow jones nasdaq sp weekly preview q earnings season sp could surge point week inflation data say fundstrats lee citi downgrade u stock see sp pull back tom lee say sp may rally point lighter inflation reading stock sp face loss profit warning loom stock investing strategy blown away sp here way refine quality sp stock buy upside market heavyweight dip ahead nasdaq rebalance morgan stanley mike wilson better q earnings enough dow close point higher monday snap day losing streak live update stock score first gain four day ahead inflation data earnings season nasdaq dow jones sp investor await cpi data earnings season meta climb nasdaq dow jones sp future slide investor brace inflation data earnings season sp index expected gain next month factset stock market today dow sp live update july,4409.52978515625,0.872
4253,2023-07-11,sp climb energy industrials flex muscle inflation data eyed want diversification wont find dow jones industrial average sp nasdaq nasdaq dow jones sp cautious trade ahead u inflation data stock market today dow end point score best day month ahead june cpi reading sp dow rise ahead monthly inflation data sp resume uptrend nasdaq dow jones sp investor await cpi data earnings season meta climb stock market today dow sp live update july market heavyweight dip ahead nasdaq rebalance sp likely going correct back mizuho warns market bull stock market concentration interpreting tech stock rally dow close point higher tuesday key consumer inflation report loom live update meme stock rally waving shortterm red flag sp index wall st end ahead cpi jpmorgan financial share gain sp risk tumbling mizuho warns market bull,4439.259765625,0.891
4254,2023-07-12,nasdaq lead wall st higher close cpi report lift sentiment sp nasdaq close highest level since april buoyed coolerthanexpected inflation report live update sp nasdaq climb cooling inflation eas fed rate hike fear stock market today dow sp live update july explainer nasdaq special rebalancing impact u earnings recession fade wall st expensive midyear outlook market history say expect outsize performance second half sp nasdaq close highest month inflation data take pressure fed nasdaq dow jones sp stock soar lower inflation data bank stock lead rally stock market could fall far recession say oxford economics here history say latest bull market headed next dow jones today index jump inflation drop domino share soar striking appordering deal uber nasdaq dow jones sp future edge higher ahead inflation data sp ekes modest gain ahead u cpi data double top still play u stock hit month high inflation fall forecast,4472.16015625,0.0
4255,2023-07-13,wall st end extends recent gain cooling u inflation u stock reached another market milestone here sp could climb even higher global x launch covered call sp etf sp finish level first time month u stock advance th day upbeat inflation data goldman partner see sp rising record year end sp easily top end portfolio manager say nasdaq lead wall st higher close cpi report lift sentiment sp hit high system go stock market bull cnbc daily open sp hit record high sp information technology sector outperformed sp month june sp dow jones underthesurface improvement sp signal big gain ahead history show cash favorite investing styleminus fee stock market today dow sp live update july stock market today live update u stock wall street return highest level year sp climb alphabet lead rally tech sp nasdaq reach fresh yearly high disinflation take hold nasdaq climb ebbing inflation eas rate hike fear,4510.0400390625,0.9648
4256,2023-07-14,sp high citigroup slip major wall street bank kick earnings topranked hedge fund chief see sp entering man land stock market still underwater apple float return level sp q earnings seen yroveryr decline seen week agorefinitiv sp end bank mostly lower index post weekly gain sp snap day win streak stock still score weekly gain bank earnings sp end bank mostly lower index post weekly gain sp earnings season update july dow close point higher friday solid earnings register best week since march live update five sp stock double money year u stock rise fourth straight day sp month peak investor look reason market could grind higher,4505.419921875,0.9545
4259,2023-07-17,investor expect positive economic data push sp materially higher good news already priced stock sp spy etf whats horizon tiprankscom last year exaggerated market swing havent entirely subsided despite sp gain u ceo compensation advantage grows v uk peer sp rise financials tech shine ahead earnings parade week dow rise sixth straight day close highest level live update sp likely report decline earnings rd consecutive quarter q nasdaq dow jones sp future stable investor await earnings surge investor bet cathie wood pay price sp hot nasdaq even hotter say strategist sp nasdaq end month high ahead busy week earnings dow jones nasdaq sp weekly preview big tech take stage investingcom stock market today dow sp live update july ahead market thing decide dstreet action tuesday equity optimism phase stock market cycle dow jones today stock rise start big week corporate earnings sp gain loss today solar stock jump first solar deal midyear thematic review contrarian consensus global x etf stock market news jul stock hit record high end latest bull market rage veteran market watcher say sp solar stock shine telecom tesla rival tumble wall st end higher earnings poised ramp sp moving lockstep consumer sentiment strategist blackrock expand proxy voting choice largest etf lone sp stock ignored wall street paying price ed yardeni see sp rising record high within next month nasdaq dow jones sp mixed sentiment investor eye earnings economic data market week ahead gold eurusd sp break usd tank tesla earnings eyed blackrock offer vote retail investor biggest etf fundstrats tom lee explains see alltime high sp year zacks analyst blog highlight spdr sp etf trust nvidia carnival pultegroup copart birkin bag one best luxury investment home depot stock return preinflation shock high here whats lifting u stock year graphic large stock driving sp gain,4522.7900390625,0.9296
4260,2023-07-18,sp bank reporting higher provision loan loss q first etf protection loss launch u sp alltime high sight hesitates sp nasdaq highest level month etf offer downside protection selloff debut weekly sp index performance sp gain loss today big bank stock advance strong earnings report dow pop point th straight positive day longest winning streak since live update dow sp rise upbeat earnings big bank market mixed midday strong earnings report lift dow sp nasdaq dow jones sp market digest earnings retail sale amid looming fed decision credit suisse raise sp target highest wall street stock market news jul dow jones today stock gain betterthanexpected bank earnings stock market today dow sp live update july equity view sp trading near fair value sp outlook next month broadening participation point gain credit suisse ups sp yearend forecast sp outlook make break week stock ahead netflix tesla earnings nasdaq sp future dipping today pnc finl servs gr nysepnc masimo nasdaqmasi bank first etf offer protection stock loss launch bank result lift stock dow seventh straight session,4554.97998046875,0.9801
4261,2023-07-19,omnicoms stock tumble lead sp loser revenue miss expectation sp terrific uptrend sector reach recordhighs analyst analyst correctly called sp rally warning whats next stock stock advance earnings pick dow notch th day gain entry point looming sp bull bearish scenario could rock stock market end year sp set hit alltime high year sp gain loss today stock rally solid earnings news u stock climb investor ass bank earnings dow eye th day gain stock market today asian share mixed investor weigh weakness tech sector nasdaq dow jones sp mixed opening expected despite strong start earnings season q equity insight dow jump point eighth straight winning day first since live update stock market today dow sp live update july short seller avoid megacap stock drive market rally stock fund cant go investor allocating equalweight rsp would crazy invest sp right,4565.72021484375,0.8893
4262,2023-07-20,sp approach time lock profit night effect etf shut overnight stock return elusive stockmarket bubble trouble check year view nasdaq sp return global x covered call etf unnecessary volatility tool sp really surge magnificent ai lifting sp nine stock let cash obscene flight hotel price u stockssp nasdaq open lower tesla netflix slump tesla netflix pull nasdaq sp lower dow end higher reuters nasdaq plummet dow pull longest winning streak year stock market today dow sp live update july stock market rally broadens transportation stock join weekhigh club kim kardashian may hero ipo market need dow post day winning streak earnings sink nasdaq sp nowhere near bubble territory year return say stockmarket rally sp gain loss today stock mixed latest earnings report dow ekes narrow gain friday th straight positive day longest rally since live update strategist raise sp price target amid redhot rally dow rise point notch first day rally since nasdaq tumble live update incentive linked esg metric among sp company stock market today nasdaq end lower earnings disappointment rare streak sp match runup alltime high nasdaq dow jones sp mixed performance amid disappointing earnings netflix tesla new sp target piper sandlers michael kantrowitz still see drop double quits valuing wall street part stock market soared year last expert weigh tesla netflix pull nasdaq sp lower dow end higher,4534.8701171875,0.957
4263,2023-07-21,dow ekes longest winning streak year nasdaq end week lower sp gain loss today index little changed mixed earnings report sp bear market point future look brighter ipbacked financing one measure market year another here unbearable weight heavyweight stock end mixed dow tenth straight day sp earnings season update july stock market outlook indicator say sp rally stretched concentration sector level changed recent month kevin oleary bidenomics fantastic stock bad small dow book th straight winning session tech stock fall disappointing earnings investor make bundle stock others panic sold like tesla interpublic group cut growth outlook tech business stumble dow jones sp may climb retail trader remain deeply bearish u stock tesla netflix pull nasdaq sp lower dow end higher sp rise defensive stock shine ahead big tech earnings wall st week ahead relentless u stock rally face fed test short squeeze market strategist try getting rest right global market update tesla netflix drag sp nasdaq mint,4536.33984375,0.7752
4266,2023-07-24,trillion earnings week loom highflying stock market sp index away creating history cross alltime high level sp rise start big week bearish technical cast shadow dow rise nearly point extends rally day longest winning streak six year live update wrong morgan stanley wilson offer stock mea culpa unleash investing power sp ultimate growth engine canadian worrying stock market breadth anymore new sp buffer etf offer downside protection here work stock gain despite tech slip active trader commentary nasdaq dow jones sp tech giant lead wall street bullish start fed rate decision loom dow jones nasdaq sp weekly preview eye microsoft investingcom stock market news jul jpmorgans kolanovic stick stock selloff call even market defies gloom market rally isnt magnificent seven anymore stock rise kick big week earnings fed decision vanguard sp value etf voov investing radar sp gain loss today oil industry stock surge oil price rise ubers stock deemed hard ignore possible sp inclusion ahead stock market today dow sp live update july goldman kostin say sp pricier laggard catch sp moving big tech could mean smaller stock gain sp reporting lower yearoveryear net profit margin th straight quarter asked ai tool think stock market rally ai chatgpt inflation push u stock toward alltime high innovator debut first buffer etf downside protection sp higher ahead big tech earnings fed decision dow lead wall street higher investor eye beyond tech,4554.64013671875,0.7348
4267,2023-07-25,sp gain loss today stock rally earnings enthusiasm sp hit highest level year ahead federal reserve meeting sp rally showing sign bubble selloff coming jpm tech stock skyrocket sp best worst sector profit margin dow close higher th straight day register longest rally since february live update stock market today dow sp live update july stock rise earnings optimism ahead google microsoft report sp risk meltdown say expert called crash sp rise tech strength ahead microsoft alphabet result meme stock rally finally prof investor lost mind sp nasdaq big tech earnings fomc dominate busy week morgan stanley mike wilson admits wrong sp index close erasing plunge vix valuestock pick momentum investor cost betting stockmarket crash cheapest since say bofa ai mania drive wall street higher close ahead earnings stock market dominated handful company biden administration worried,4567.4599609375,0.8658
