,Date,Title,cp,Sentiment_Score
4493,2024-03-07,sp index close record height reach overbought condition since january sp hit peak stock set record stock market today sp hit fresh record nasdaq pop ahead job day within sp there meet eye goldman sachs expects u buyback top trillion u stockssp hit record high chip stock extend rally nasdaq sp negative divergence one place goldman sachs expects u buyback top trillion sp nasdaq post record high dovish powell comment stockmarket news today sp hit record powell reaffirms cut sp reclaims alltime high powell hint rate cut nvidia break bitcoin nears record level sp hit new record ahead u job report spx sp blast new record powell speech boost ratecut optimism sp nasdaq post record high dovish powell comment sp gain loss today index notch record close ahead job report sp inch away alltime high amid rate cut expectation gift nifty sp index time stamped sp equal weight index touch record high sp notch new record high stock close green wall street rally sp post record closing high stockmarket news today sp hit record powell reaffirms cut expect sp top time sell wall street rally sp post record closing high sp index time stamped index fund work stock market today sp hit fresh record nasdaq pop ahead job day sp hit record fed powell admits surprise nvidia crack tesla battle possible loss expect gain fastrising stock analyst sp hit peak stock set record wall st rally sp post record closing high stock market news today sp nasdaq notch fresh record high sp nasdaq post record high dovish powell comment sp equal weight index touch record high stock market news today sp nasdaq notch fresh record high goldman sachs expects u buyback top trillion sp hit peak stock set record expect sp top time sell stock market today dow sp live update march sp hit peak stock set record sp notch new record high stock close green sp gain loss today index notch record close ahead job report wall street rally sp post record closing high goldman sachs lift stock buyback forecast sp company expect sp top time sell expect gain fastrising stock analyst sp notch new record high stock close green sp rally record high powell comment sp dow nasdaq since high sp inch away alltime high amid rate cut expectation gift nifty sp hit record fed powell admits surprise nvidia crack tesla battle possible loss index fund work sp rally record high powell comment sp index time stamped goldman sachs lift stock buyback forecast sp company sp index close record height reach overbought condition since january spx sp blast new record powell speech boost ratecut optimism sp nasdaq rise new record sp index time stamped sp notch new record high stock close green stockmarket news today sp hit record powell reaffirms cut sp nasdaq rise new record index fund work sp inch away alltime high amid rate cut expectation gift nifty stock market news today sp nasdaq notch fresh record high sp nasdaq rise new record wall st rally sp post record closing high stock market today dow sp live update march nasdaq sp negative divergence one place goldman sachs lift stock buyback forecast sp company stock market today sp hit fresh record nasdaq pop ahead job day sp equal weight index touch record high sp reclaims alltime high powell hint rate cut nvidia break bitcoin nears record level sp hit new record ahead u job report spx sp blast new record powell speech boost ratecut optimism sp nasdaq rise new record sp gain loss today index notch record close ahead job report sp inch away alltime high amid rate cut expectation gift nifty expect sp top time sell sp dow nasdaq since high within sp there meet eye nasdaq sp negative divergence one place spx sp blast new record powell speech boost ratecut optimism sp hit new record ahead u job report sp reclaims alltime high powell hint rate cut nvidia break bitcoin nears record level sp gain loss today index notch record close ahead job report sp index close record height reach overbought condition since january sp rally record high powell comment goldman sachs lift stock buyback forecast sp company index fund work wall street rally sp post record closing high sp hit record fed powell admits surprise nvidia crack tesla battle possible loss sp dow nasdaq since high expect gain fastrising stock analyst wall st rally sp post record closing high stock market today dow sp live update march u stockssp hit record high chip stock extend rally within sp there meet eye index fund work u stockssp hit record high chip stock extend rally,5157.35986328125,0.9986
4494,2024-03-08,stock market today sp snap week win streak nvidia nosedive dent tech warren buffett owns etfsthis one better everyday investor expert say wall street slip record nasdaq leading decline active equity fund consistently lag sp choose instead nasdaq drop friday nvidia tumble dow close worst week since october live update u stock market sp nasdaq hit record high powell signal rate cut ahead mint sp soar new high best stock ytd wall street rally sp post record closing high stock retreat despite sp nasdaq record lowest number sp company citing recession earnings call since q wall street slip record nasdaq leading decline sp nasdaq hit record high job data strengthens rate cut bet sp nasdaq hit record high job data strengthens rate cut bet investor sentiment improves sp surge fresh high active equity fund consistently lag sp choose instead nasdaq drop friday nvidia tumble dow close worst week since october live update warren buffett owns etfsthis one better everyday investor expert say sp soar new high best stock ytd bofa raise sp target predicts broadening stock retreat despite sp nasdaq record bofa raise sp target predicts broadening job report solid hiring mean fed rate cut may wait sp slip u stock market sp nasdaq hit record high powell signal rate cut ahead mint wall street rally sp post record closing high sp nasdaq hit record high job data strengthens rate cut bet u stock market sp nasdaq hit record high powell signal rate cut ahead mint sp nasdaq hit record high job data strengthens rate cut bet job report solid hiring mean fed rate cut may wait sp slip bofa raise sp target predicts broadening sp nasdaq hit fresh alltime high despite weak job data gift nifty sp nasdaq post record high fedfriendly u unemployment report job report solid hiring mean fed rate cut may wait sp slip u stock market sp nasdaq hit record high powell signal rate cut ahead mint sp nasdaq post record high fedfriendly u unemployment report u stock market sp nasdaq hit record high powell signal rate cut ahead mint lowest number sp company citing recession earnings call since q wall street slip record nasdaq leading decline sp gain loss today costco share drop quarterly revenue miss investor sentiment improves sp surge fresh high active equity fund consistently lag sp choose instead nasdaq drop friday nvidia tumble dow close worst week since october live update warren buffett owns etfsthis one better everyday investor expert say sp soar new high best stock ytd stock market today sp snap week win streak nvidia nosedive dent tech sp nasdaq post record high fedfriendly u unemployment report stock retreat despite sp nasdaq record sp nasdaq hit fresh alltime high despite weak job data gift nifty sp gain loss today costco share drop quarterly revenue miss investor sentiment improves sp surge fresh high sp nasdaq hit fresh alltime high despite weak job data gift nifty stock market today sp snap week win streak nvidia nosedive dent tech wall street rally sp post record closing high sp nasdaq hit record high job data strengthens rate cut bet stock market today sp snap week win streak nvidia nosedive dent tech sp gain loss today costco share drop quarterly revenue miss wall street rally sp post record closing high lowest number sp company citing recession earnings call since q sp nasdaq hit fresh alltime high despite weak job data gift nifty u stock market sp nasdaq hit record high powell signal rate cut ahead mint,5123.68994140625,0.9973
4495,2024-03-15,u stock market wall street end ppi data chipmakers fall nasdaq dow jones sp news tech sector lead market decline sp gain loss today jabil share fall guidance cut sp close lower inflation worry notch second straight weekly loss live update nasdaq index dow jones sp news mixed signal amid inflation concern u stock end lower tech weighs sp ahead fed meeting secondhighest number sp company citing ai earnings call past year gold bitcoin stock hit record high week came inflation data longterm bull market expert ed yardeni stand yearend sp target predicts barclays explains sp keep rallying despite hot cpi ppi data wall st drop techrelated share investor ass rate outlook nasdaq slip around inflationary jitter persist u stock end lower tech weighs sp ahead fed meeting u stock fall investor digest impact hot inflation data fed outlook sp price forecast sp still looking break higher stock market live update sensex slip pt nifty close mark bizarrely overvalued sp may crash recession hit strategist spx sp log loss investor flee risk asset amid rising inflation sp x return four year nifty outperforms global peer headed poll gold bitcoin stock hit record high week came inflation data sp weekly price forecast sp weekly chart show potential consolidation sp price forecast sp still looking break higher u stock end lower tech weighs sp ahead fed meeting bizarrely overvalued sp may crash recession hit strategist nasdaq slip around inflationary jitter persist nasdaq dow jones sp news tech sector lead market decline sp gain loss today jabil share fall guidance cut sp weekly price forecast sp weekly chart show potential consolidation nasdaq index dow jones sp news mixed signal amid inflation concern top may forming sp nasdaq top may forming sp nasdaq u stock fall investor digest impact hot inflation data fed outlook u stock market wall street end ppi data chipmakers fall barclays explains sp keep rallying despite hot cpi ppi data wall st drop techrelated share investor ass rate outlook longterm bull market expert ed yardeni stand yearend sp target predicts sp x return four year nifty outperforms global peer headed poll secondhighest number sp company citing ai earnings call past year u stock end lower tech weighs sp ahead fed meeting stock market live update sensex slip pt nifty close mark sp close lower inflation worry notch second straight weekly loss live update spx sp log loss investor flee risk asset amid rising inflation,5117.08984375,-0.8555
4498,2024-03-18,analyst optimistic rating sp company heading q sp eye support test amid rising yield u dollar fed boj focus super micro trade lower sp debut tesla stock worst sp start sp gain loss today tesla share jump model price increase headtohead ishares sp v ishares u esg election year investing jitter consideration could set ease stock market today sp close record focus shift fed decision investingcom sp newcomer super micros stock tank stock market today dow sp live update march super micro computer joined sp aifueled stock surge sunk sp consumerdiscretionary sector left behind stock market megacaps rally lift techheavy nasdaq supermicro make big league sp inclusion validates growth trajectory supermicro make big league sp inclusion validates growth trajectory super micro computer joined sp aifueled stock surge sunk super micro stock slide join sp sp gain loss today tesla share jump model price increase sp q buyback increase compared q full year show decline analyst optimistic rating sp company heading q super micro computer ride ai server boom join sp u stockssp nasdaq future tick ahead fed meeting ai conference super micro trade lower sp debut sp eye support test amid rising yield u dollar fed boj focus nasdaq sp open higher applegoogle news super micro computer fell added sp today chance buy ai stock tesla lead sp winner new member super micro tumble sp consumerdiscretionary sector left behind stock market nasdaq sp open higher applegoogle news tesla biggest sp loser year boeing super micro computer fell added sp today chance buy ai stock super micro computer stock fall sp addition u stockssp nasdaq future tick ahead fed meeting ai conference super micro computer stock fall sp addition sp doesnt always beat fed economic drum strategist nasdaq index dow jones sp news wall street edging higher tech sector strength undertheradar warren buffett stock could soar sp continues higher supermicro join sp index recognition remarkable growth sale market capitalization dow jones nasdaq sp weekly preview focus fomc wall street end higher investor juggle fed nerve ai enthusiasm megacaps rally lift techheavy nasdaq headtohead ishares sp v ishares u esg election year investing jitter consideration could set ease sp price forecast sp continues see buyer stock market today sp close record focus shift fed decision investingcom sp newcomer super micros stock tank stock market today dow sp live update march super micro computer ride ai server boom join sp investor sentiment fall sp record second weekly loss tesla lead sp winner new member super micro tumble super micro stock slide join sp investor sentiment fall sp record second weekly loss sp price forecast sp continues see buyer nasdaq index dow jones sp news wall street edging higher tech sector strength wall street end higher investor juggle fed nerve ai enthusiasm tesla stock worst sp start supermicro join sp index recognition remarkable growth sale market capitalization undertheradar warren buffett stock could soar sp continues higher sp doesnt always beat fed economic drum strategist tesla biggest sp loser year boeing dow jones nasdaq sp weekly preview focus fomc sp q buyback increase compared q full year show decline,5149.419921875,0.9991
4499,2024-03-19,piper sandler say sp magnificent need break market news march stock rebound amid nvidia chip unveiling boj rate hike super micro computer stock tumble offer sell share super micro computer stock tumble offer sell share nike earnings buy sp stock hold sp close record high beyond bell nasdaq dow jones sp news nvidia lower crypto market shaken amid rate hike fear nasdaq index dow jones sp news tech shift fed focus shape wall street nasdaq index dow jones sp news tech shift fed focus shape wall street stock market indicator perfect track record signal big move sp right sp close record high chip stock lag sp gain loss today international paper name new ceo share soar sp price forecast stock slide electronic overnight session stock market today sp close first time fed lean dovish u stock market wall street end higher investor juggle fed nerve ai enthusiasm nasdaq dow jones sp news nvidia lower crypto market shaken amid rate hike fear u stock market wall street end higher investor juggle fed nerve ai enthusiasm sp gain loss today international paper name new ceo share soar sp close record high chip stock lag stock market indicator perfect track record signal big move sp right sp price forecast stock slide electronic overnight session dow jones industrial average djia prediction palantir added sp year here sp forecast spx fall caution ahead fed meeting piper sandler say sp magnificent need break stock market today sp hit fresh record eye turn fed decision sp future point lower ahead fed decision day prediction palantir added sp year here super micro computer join sp capitalizes ai server boom market news march stock rebound amid nvidia chip unveiling boj rate hike wall street advance nvidia fed meeting focus stock market today sp close first time fed lean dovish sp close record high beyond bell nasdaq dip chipmakers slide sp tread water fed focus nvidia alphabet among u tech stock rally sp technology index gain mint nasdaq dip chipmakers slide sp tread water fed focus stock market today nasdaq surge lead stock higher fed meeting deck nike earnings buy sp stock hold stock market today nasdaq surge lead stock higher fed meeting deck stock market today sp hit fresh record eye turn fed decision nvidia alphabet among u tech stock rally sp technology index gain mint nvidias taylor swift moment doesnt move stock market rise nvidias taylor swift moment doesnt move stock market rise wall street advance nvidia fed meeting focus dow jones industrial average djia sp forecast spx fall caution ahead fed meeting sp future point lower ahead fed decision day super micro computer join sp capitalizes ai server boom,5178.509765625,0.9963
4500,2024-03-20,wall st end higher fed keep three rate cut horizon spx sp log new record closing high fed policy meeting get underway sp close historic mark fed market wrap stock market today sp notch record high fed affirms rate cut federal reserve stick three rate cut year barely sp rise nasdaq index dow jones sp news fed decision day spark early weakness sp spx lose momentum bond struggle sp nearing turning point spring equinox stock market today sp notch record close stock continue record run investingcom sp gain loss today index print record close fed affirms forecast stock market today federal reserve rate cut gucci sp dollar bitcoin fed meeting dow sp nasdaq end alltime high policymakers maintain ratecut forecast sp dow rally record high fomc maintains rate cut projection ftse dax sp look bid ahead fomc meeting nasdaq dow jones sp news wall street edge fed decision loom sp sector rise fed chair powell press conference market news march stock climb record yield fall fed maintains rate cut forecast worst stock highest paying dividend stock sp buy sp achieves new milestone top nontech pick fed ratecut surprise may fool everyone sp ok sp gsci precious metal index sp comparison u stock hold ground ahead fed decision market dodged bullet fed meeting sp head fresh record peak dow notch record high interest rate cut loom sp forecast sp look likely see buyer reason stock rally wednesday fed meeting according tom lee news update march fed signal bps cut reddit price share top end ipo range,5224.6201171875,0.4588
4501,2024-03-21,sp close th record high year beyond bell stock market outlook sp rally another year stock market today dow jones sp nasdaq post new record dow sp nasdaq end record high fed decision sp postfed rally last keep buying sp say wall street bullish bank target taking stock q equity market outlook ai rescue beat sp cagr company sp may inaccurately valued reveals interbrands report sp gold near alltime high postfomc u rate dollar sink u fed meeting highlight fomc leaf key lending rate unchanged sp break first ti u fed rate jerome powell led fomc leaf key rate unchanged sp break socgen lift sp target u exceptionalism solid stock buy sp hit new high emini sp emini nasdaq emini russell option reach record volume market news march index notch record apple slump reddit jump debut sp gain loss today micron technology stock boosted ai demand decoding sp current standing wall street think sp rise another next year there hitch wall street hit record closing high ratecut optimism chip sector rally socgens kabra lift sp target highest wall street sp hit th record year riskon push market wrap nasdaq dow jones sp news wall street hit new high apple face doj lawsuit keep buying sp u exceptionalism go strength strength socgen investingcom societe generale raise sp target citing artificial intelligence boom seagate stock topped sp index today sp price forecast wall street celebrates fed nasdaq index dow jones sp news wall street soar fed rate cut hint dow close point higher major average surge fresh record live update best investment beat inflation forbes advisor industry analyst project increase sp price next month deutsche bank bankim chadha predicts sp yearend target,5241.52978515625,0.9926
4502,2024-03-22,sp overbought u dollar verge breakout key level watch today sp weekly price forecast sp continues look strong nasdaq dow jones sp news major index eye weekly uplift despite friday slip sp gain loss today lululemon nike stock fall amid soft guidance sp price forecast sp continues float fxempire bmo strategist called stock rally bracing correction sp future gyrate dollar strength persist sp emini future swing short trade idea socgen boost sp forecast sp snapshot biggest weekly gain nasdaq index dow jones sp news market hit new peak momentum build sp soared last five month societe generale lift sp target say run bull here much apple influence sp waned year dow sp slip still set year best week ftse surge pause dax sp consolidate record high sp end near flat index post biggest weekly gain year analysed sp company may inaccurately valued interbrand research nifty sensex today expect indian stock market trade march mint sp hit wall end best week market wrap fed chair powell blessed sp rally ignored,5234.18017578125,0.9906
4507,2024-04-01,crash soar trader preparing stock market extreme nasdaq dow jones sp news wall street waver amid inflation uncertainty sp technical analysis average sp stock overvalued magnificent seven goldman dow close point lower begin april treasury yield pop live update spx sp future kick april green solid gain bumper first quarter sp bank stock outperformed index q market open essential thing know april mint sp gain loss today share memory chipmakers push higher dow sp close lower manufacturing data lift yield graphic sp producing solid quarterly result stock market today sp begin q red spiking treasury yield blunt bull investingcom nasdaq index dow jones sp news bullish momentum q strong q performance sp price forecast sp continues look strong monday market news april tech spared stock pullback treasury yield jump pce crash soar trader preparing stock market extreme decoding sp first quarter surge stock market outlook sp soar another stay nasdaq dow jones sp news wall street waver amid inflation uncertainty graphic sp producing solid quarterly result nasdaq index dow jones sp news bullish momentum q strong q performance watch rbc calvasina boost sp target stock market today dow sp live update april stock market outlook sp soar another stay average sp stock magnificent seven overvalued goldman say average sp stock overvalued magnificent seven goldman sp bank stock outperformed index q sp tracker hit record equity etf flow sp price forecast sp continues look strong monday average sp stock magnificent seven overvalued goldman say dow sp close lower manufacturing data lift yield sp gain loss today share memory chipmakers push higher market open essential thing know april mint stock rally extends th straight month march sp rise sp continue soaring gain q here history show zacks investment idea feature highlight russell index sp index etf nasdaq index etf nvidia dow nasdaq sp weekly preview market brace strong employment data decoding sp first quarter surge stock rally extends th straight month march sp rise sp tracker hit record equity etf flow,5243.77001953125,0.9929
4508,2024-04-02,dow fall nearly point continue second quarter weak start sp smart trader trading chop dow sp close lower manufacturing data lift yield sp q standouts energy communication sector lead topperforming stock historic sp rally q flash bullish signal ninth time since sp price forecast stock continue drift sp stock turn month u stock market dow sp close lower manufacturing data lift yield wall street skid yield climb strong data dow nasdaq fall tick size value vary index future apple tesla dreadful two instead magnificent seven stock market today dow sp fall trader sour ratecut pace sp gain loss today health care stock move lower sp chart analysis show pullback likely investor hedge sp new alltime high capping stock best start year since dow tumble nearly point falling second day rough start new quarter live update nasdaq dow jones sp news u stock drop amid reduced rate cut expectation demand zone sp need hold video sp chart analysis show pullback likely investor hedge dow tumble nearly point falling second day rough start new quarter live update stock market today dow sp fall trader sour ratecut pace sp stock turn month sp new alltime high capping stock best start year since apple tesla dreadful two instead magnificent seven u stock market dow sp close lower manufacturing data lift yield dow fall nearly point continue second quarter weak start u market sluggish mixed action dow drop point sp dow sp close lower manufacturing data lift yield sp gain loss today health care stock move lower wall street skid yield climb strong data dow nasdaq fall nasdaq dow jones sp news u stock drop amid reduced rate cut expectation sp momentum report historic sp rally q flash bullish signal ninth time since sp price forecast stock continue drift u market sluggish mixed action dow drop point sp,5205.81005859375,0.9118
4509,2024-04-03,stock market today dow sp live update april deka launch sp etf report find fifth sp firm hit data breach sp gain loss today cosmetic stock pressured soft demand outlook nasdaq index dow jones sp news wall street lower amid sector weakness nasdaq need recover quickly sp russell ripe bounce higher u market recover day loss sp gift nifty gain sp nasdaq close slightly higher soft service sector data fed comment sp gain loss today cosmetic stock pressured soft demand outlook sp best first quarter five year nasdaq index dow jones sp news wall street lower amid sector weakness sp nasdaq close higher dows third day q loss sp yesterday selling pressure already running gas sp djia enter worst month year period stocktradersalmanac investingcom sp retreat alltime high correction stock market today dow sp live update april sp djia enter worst month year period stocktradersalmanac investingcom sp nasdaq testing uptrend strength nasdaq need recover quickly sp russell ripe bounce higher sp nasdaq close slightly higher soft service sector data fed comment deka launch sp etf sp struggling oil yield continue topside push news update april iger defeat peltz disney proxy war eurozone inflation fall u market recover day loss sp gift nifty gain,5211.490234375,-0.5267
