,Date,Title,cp,Sentiment_Score
4394,2023-11-29,jpmorgans sp outlook grimmest wall street history sp dividend yield nasdaq index dow jones sp news stock rise monthlong rally resume sp price forecast stock market continues ignore gravity sp gain loss today netapp gm rise hormel la vega sand fall stock market today dow sp live update november stockmarket outlook sp set record high bofa say sp narrow trading range since christmas eve sp nasdaq brace move higher russell bull hold card here close stock market index alltime high jpmorgan see sp dropping macro risk build dow ekes gain stock mostly fall fed survey show economy slowed jpmorgan say sp fall next year amid challenging macro backdrop nasdaq dow jones sp news stock future climb amid fed rate hike pause speculation sp forming local top,4550.580078125,0.8481
4395,2023-11-30,sp end lower mixed fed message pce deck bull control stock market targeting sp alltime high nasdaq dow jones sp news u stock score big november nasdaq index dow jones sp news u stock future surge inflation data sp reached peak sp gain loss today demand data cloud ai help lift salesforce sp spx gained month secondbest november since stock left behind november historic rally stock market today dow sp live update december dow surge point post highest close nearly year stock log best month year market news nov salesforce boost dow high cap stock best month year dow jones sp nasdaq reverse multimonth high whats next jpmorgan see downside risk sp next year investingcom dow gain sp end lower mixed fed message jpmorgan predicts bleak sp outlook,4567.7998046875,0.969
4396,2023-12-01,stockmarket outlook sp lock best month november news update december sp close month high gold hit record despite rate cut pushback uber jabil builder firstsource set join sp sp gain loss today ulta beauty earnings report resurgent sp crest new closing high rollercoaster year uber become sp constituent sp index jpmorgan issue wall street lowest sp price target top stock sp index weight december industry analyst overestimated sp eps uber share pop inclusion sp uber jabil builder firstsource join sp index sp set highreversing summer slump sp rise highest close amid rate cut optimism sp hit record reversing summer loss nasdaq dow jones sp news future mixed blue chip peak nasdaq index dow jones sp news bracing powell speech amidst rate cut rumor ubers jabils stock join sp sp rise friday close high live update sp weekly price forecast sp continues power higher dow top stock end gain following remark fed powell sp clinch highest close since march,4594.6298828125,0.9816
4399,2023-12-04,sp gain loss today alaska air drop hawaiian airline purchase propicks beat sp cuttingedge aipowered stock selection uber set join sp index latest sign turnaround ridehailing service uber share pop company slated join sp uber join sp index stock jumping bull market view sp hit fresh yearhigh first quadruple leveraged sp etn proposed analyst correctly predicted rally give sp forecast next year investingcom stock market outlook sp hit obstacle could make break rally stifel say sp top soon stuck secular bear market sp top around stifels bannister uber stock jump set join sp market news dec stock fall gold retreat record bitcoin top k jpmorgans top chartist say sp tumble way back retesting bear low wall street end megacaps give back gain uber stock alert uber joining sp uber share rally sp inclusion sp technical analysis stock market today dow sp live update december rate cut hope drive sp best month year november ubers stock head highest close year getting sp nod uber added coveted sp index post rebalancing stifel strategist see sp struggling gain much ground mid dow jones nasdaq sp weekly preview rally hold nasdaq dow jones sp news tech sector downturn drive u market decline uber share climb company secures spot sp uber share rally company set join sp index sp unlikely top least mid stifel say u stock slip following sp fresh high bond yield rise analyst making larger cut average eps estimate sp company q,4569.77978515625,0.9923
4400,2023-12-05,wolfe research say investor optimistic see sp dropping climate disclosure russell sp stock market casino new x leverage sp etn met caution sp price forecast sp continues consolidate sp december trader get x return sp quadruple leveraged fund there juicedup way get time return sp come many risk jpmorgan chart guru see drop sp mid recession sp gain loss today charter drop amid broadband subscriber concern uber added sp make stock buy brief history bear market u stock market today dow jones sp nasdaq slip november rally fewer sp company discussing ai earnings call q compared q stock market today dow sp live update december market rally spread beyond magnificent stock rest sp market news dec tech lift nasdaq year yield sink month low job data dow close lower second day late rally sputter live update chart sp nobody talk sp rally key level nears alltime high chartist say happens next sp forecast closer look santa rally nasdaq dow jones sp news smallcaps shine major index take breather dow jones post backtoback loss u job opening fall month low bear left worrying refrain coming wall street bank america say sp hit new record high stock play bullish nasdaq index dow jones sp news future dip trader eye job report gitlab soar beyond bell sp close session narrowly lower monthly market wrap november,4567.18017578125,0.7506
4401,2023-12-06,wall st end lower investor weigh fresh employment data potential stock surprise goldman sachs unveils sp laggard major gain stock market today dow sp live update december charlie munger believed investing got much harder lifetime even pro face nearly zero chance beating sp gain loss today campbell soup profit heat higher price dow sp slide third straight day recent rally falter live update dow jones sp end lower third day investor await labormarket data uber set join sp index market news dec stock fall year yield dip labor market data point cooling economy campbell soup lead sp gain higher price help profit beat estimate nasdaq index dow jones sp news labor data spark optimistic trading apple hit trillion cap jp morgan predicts sp crash here market bet thrown chaos u recession conundrum tech titan strategy beat sp last decade sp dividend aristocrat produce better return lower risk overall index nasdaq sp hold breakout support russell pegged minor resistance bargain buy stock lagging sp big potential nasdaq index dow jones sp news resilient future ahead adp payroll data,4549.33984375,0.9622
4402,2023-12-07,sp rally without magnificent leading way easy say bofa gmo quality mutual fund beat sp even without nvidia tesla stock stock market today dow sp live update december nasdaq index dow jones sp news mixed sentiment ahead key job report nasdaq close higher dow sp snap day losing streak live update sp gain loss today ai excitement power amd alphabet sp technical analysis sp notch new high friday sixweek hot streak solid economic data live update sp eas promising gap higher open yield hit month low nasdaq post gain renewed ai optimism sp dow snap day drop ahead friday job report dow trail sp since sp december amd stock price soar recent trend board composition refreshment russell sp stock market biggest bull expects fundstrats lee reveals highest sp forecast wall street dow rise point clinch third straight winning day stock december hot streak resume live update uber stock set join sp buy join best sp dividend stock buy history suggests sp could soar here stock buy global smallcap stock lure bargain hunter sluggish nasdaq end sharply higher alphabet amd fuel ai surge nasdaq index dow jones sp news investor caution amidst labor market concern wall street bull give highest sp forecast yet sp dividend stock pay year treasury better buy berkshire hathaway vanguard index fund bearish stock market outlook jpmorgan may derailed smallcap surge,4585.58984375,0.9843
4403,2023-12-08,citi strategist upbeat u stock fueled earnings stock market outlook liquidity rally rocket sp record high sp may rise end u stockmarket rally broadens citi say sp future pull back slightly warmer u job data news update december u add job november uk competition watchdog examining microsoft lie ahead sp etf stock market outlook extremely rare signal point new high soon company churn u profit year industry analyst predict sp close unlocking future sp emini future watching next u stock end higher job report dow score longest weekly winning streak since february portfolio offer better riskreward sp gain loss today paramount global share soar amid sale talk nasdaq index dow jones sp news wall street cautious strong job report rate cut hope dim market news dec sp notch month high treasury yield tick following strong job report sp nasdaq notch highest close since early question answered invest u market via indian mutual fund mint fantastic time add small midsizecompany stock portfolio say investing pro uber riding sp here stock could soar higher wall st week ahead yearend rally u stock face twin test fed inflation data loom,4604.3701171875,0.9786
4406,2023-12-11,dow jones nasdaq sp weekly preview focus shift nfp cpi fomc russell primed gain sp nasdaq confirm breakout wall street close fresh high inflation data fed eyed dow jones future market look ready run stock buy zone tesla set healthcare giant cigna biggest sp stock mover mondayheres citi see big year stock sp finishing dow slightly higher investor await inflation data fed policy meeting record high card u stock electronics manufacturing stock join sp here big deal market outlook citi lower midyear sp target analyst predict next year top stock whats store sp top pick wall street bull make case sp hit sp hit new high rally last here hsbc forecast surveillance sp call blow away bull bear doubt there good chance breakout sp technical analyst say stock soar yearend roaring scenario yardeni say sp spx rise historical indicator say yes stock market outlook return roaring spark rally sp betting grows sp hit record high oppenheimer joining wall street bullish call oppenheimer stoltzfus see record high sp oppenheimer see sp ending sp forecast galore analyst finally get right trade week short sp soybean sugar outlook sp make six active trader commentary stock market today dow sp live update december stock market news today dow nasdaq sp notch new high sp news index reach high analyst forecast sp rally new target softlanding view ed yardeni targeting sp two year sp cy earnings preview analyst expect doubledigit earnings growth sp price forecast stock market threatening major breakout sp gain loss today cigna lead index advance calling humana deal stock market today sp record fed rate cut soft landing macys nasdaq index dow jones sp news federal cpi set shape market outlook tom lee sp could nasdaq index dow jones sp news direction hinge upon fed policy decision sp latest roster update top new face invest big tech ability deliver ai profit loom sp,4622.43994140625,0.9886
4407,2023-12-12,wall st hit fresh high inflation data fed deck dow sp hit new high year critical week market begin sp gain loss today franklin resource get boost higher aum sp gain year push past market nears alltime high stock close higher th day sp touch highest level since january live update market news dec sp rise month high november inflation report sp surge way roaring scenario say ed yardeni sp yearend rally lift stock record close nasdaq index dow jones sp news investor await fed signal amid inflation uncertainty dow jones record third highest close history inflation report eye fed decision stock market today dow sp live update december undervalued sp stock billionaire loading stock market outlook sp tumble mild downturn rallying stock market news sp dow nasdaq approach alltime high u index analysis sp hit high vix hit postcovid low ahead fed nasdaq index dow jones sp news wall street optimistic ahead key cpi report fed meeting sp continue higher,4643.7001953125,0.91
4408,2023-12-13,federal reserve may throw curveball sp year treasury yield market news dec dow jump point record high fed forecast rate cut stunning stock market statistic racing buy button nasdaq index dow jones sp news market eye fed policy amid steady inflation indicator russell pace best month versus sp nearly year hsbc sp reach next year could rally even dow end record high fed signal lower borrowing cost late invest sp oppenheimer stoltzfus sp path dow flip higher sp nasdaq remain fresh high ahead fed policy decision u stock market major index record highest closing since eye fed sp gain loss today regional bank get boost fed hsbc see sp exceeding recession avoided investingcom nasdaq index dow jones sp news future rise ahead fed decision sp strategist turning bullish dow jones hit alltime high investor cheer progress inflation ubs see upside sp end next year sell sp every scenario loom rally overheating equalweighted etf outperform sp hsbc see sp gaining end helped rate cut market outlook stock market today dow sp live update december stock market today live update,4707.08984375,0.9716
4409,2023-12-14,sp nears historic day nasdaq russell break analyst react dovish fed sp break year yield fall sp gain loss today solar stock soar fed signal rate cut next year sp price forecast stock market continues rally loose fed nasdaq index dow jones sp news benchmark blue chip challenging record high sp stretched sell signal nowhere sight dow score second record close row lowerrate bet friday sp nasdaq rebalance may reflect concern concentration risk u stock market new high dow sp nasdaq fed decision dow continues rally close point strong economic data hope falling rate live update stock market today dow sp live update december nasdaq index dow jones sp news fed dovish stance spur market surge sp etf dominate equalweight magnificent seven back fashion antimomentum etf back favor investor sp forecast spx extends rally fed dovish pivot arrives sp end higher investor bet lower rate sp something done time since history say stock market next dow nasdaq close higher friday extending rally seventh winning week,4719.5498046875,0.9538
4410,2023-12-15,successful midcap company undervalued sp stock buy sp price forecast stock grinding away sp dow post longest weekly winning streak since pandemic sp year date investor index set strategy stay invested expert say trillion option expiry loom sp eye alltime high market news dec stock post seventh weekly gain dow close fresh record sp post longest weekly winning streak since finish flat day analyst optimistic rating sp company heading sp gain loss today solar stock power dow nabs rd straight record close sp longest weekly win streak year sp post longest weekly winning streak since end flat day surprise sp higher fed hike sp isnt strategist sp snapshot record high uber stock cruise week high nasdaq index dow jones sp news major index set th week gain stock market outlook rare bullish signal say sp soar debate wall street fed pivot soon nasdaq index dow jones sp news wall street stumble slip post fed williams cautious comment,4719.18994140625,0.9869
4413,2023-12-18,here complete rundown wall street stock market prediction g etf rise global stockmarket rally sp approach alltime high goldman sachs see sp hitting boosting forecast sp gain loss today amazon reportedly aim expand reach sport sp stock day high could hint doubledigit return ahead sp form doji pattern bearish sign stockmarket investor even new year goldman sachs already lifted sp target major stock index add uber doordash uber join sp stock index first profitable quarter stock market today sp end higher fed speak pushback fails cool rally investingcom goldman kostin lift sp forecast month setting sp cy earnings preview le growth expected could sp fly high stock market today dow sp live update dec goldman sachs raise sp forecast dow jump point ninth winning day sp nears record live update goldman sachs boost sp target increased confidence fed rate cut march dow jones nasdaq sp weekly preview eyeing record high investingcom market news dec stock gain oil rise conflict disrupts red sea shipping dow jones alltime high sp nasdaq bear fail reverse bull trend invested sp joe biden became president here much youd today,4740.56005859375,0.9773
4414,2023-12-19,fund manager upbeat stock market since january sp nears record u open sp nears alltime high stock continue rally dow climb fifth straight record close ratecut hope underpin sentiment dow close point lower wednesday snap day win streak live update sp inch within alltime high fed left confused recent stock surge wall street close alltime high sp dow surge amid dovish move japan central bank sp climb rally broadens close gap record high stock market today dow sp live update december sp momentum report sp gain loss today enphases cost cutting charge solar stock sp etf see historic b influx amid stock surge sp q buyback impact earnings per share continues decline buyback tax reduced market news dec sp close within alltime interest rate optimism persists stock market today sp jump ongoing rally put record high sight investingcom enphase energy stock surge pace sp gainer job cut seen good thing sp fund see biggest singleday inflow ever etf,4768.3701171875,0.9769
4415,2023-12-20,news update december sp fall three month toshiba delists enters private hand fedex sp worst performer today problem analyst say u economist warned bring biggest crash lifetime predicts shocking investor instead chasing sp say well fargo time buy sp worstperforming stock year sp may plunge spring hit record high year end papic stock market news today stock market rally stall sp post worst day since october dow tumbled point nearly hitting record u equity close lower sharp turnaround late wednesday sp fall sp overbought level since september tesla stock tsla beaten sp joining sp gain loss fedex general mill see slumping demand dow jones end point lower day winning streak wall street tumble sharply lower close abrupt selloff snap rally proshares launch sp etf zeroday call option stock market today dow sp live update december,4698.35009765625,-0.9186
4416,2023-12-21,stock market today dow sp live update december news update december u gdp revised q angola leave opec sp gain loss today micron boosted higher price ai demand dow jones end point higher sp rebound biggest drop month evening briefing sp biggest mover stock market indicator accurate since signaling big move sp right ranking top sp stock year return time take profit say strategist top sp target next year stock market news today sp nasdaq lead stock market rebound worst day since september hottest option trade sp spreading smaller stock visualizing year stock market cycle micron surged lead sp gain latest earnings reportheres make money investing sp annuity one weirdlooking bull market dont show return similar sp client kill dow close higher point sp rebound worst day since september live update sp nasdaq dow jones beyond bell sp drop fault zeroday option dte cboe say bull trap ubs analyst see sp falling low h investingcom santa claus bring good cheer wall street holiday season last year prediction pan sp stock gained lost year sp log worst day two month global rally stall tesla underperforms sp since joining index,4746.75,-0.5859
4417,2023-12-22,sp close higher friday register longest weekly win streak since live update stock market today sp nike china tencent pce inflation fed tesla getting trounced sp three year stock market today sp rise clinch longest weekly win streak since investingcom sp storm toward best quarter since santa claus rally take hold sp gain loss today nike warns soft sale plan spending cut wall street diversification trade get crushed sp soar sp winner must buy top sp stock buy dip big gain federal reserve key inflation rate fell sp rise warren buffett really like etf here etf thats good could help retire millionaire sp nearly perfect indicator align stock trader almanac investingcom investor make billion magnificent stock year goldman sachs one every six company sp currently activist invested watch ed yardeni eye sp santa claus grinch show year,4754.6298828125,0.9829
4421,2023-12-26,stock market today santa claus rally sp eyeing record high investor lose billion giant loser year stock market today sp nears new high intel stock soar stock market rally postchristmas sp approach record high sp stock upside sp trade within whisker alltime high market wrap magnificent tech stock outperform sp goldman sp gain loss today intels billion incentive deal israel visualized top sp stock year bet sp say david sowerby sp stuck limbo well fargo pinpoint favored sector next year new alltime high awaits sp investor buy euphoria say strategist market news dec stock kick final week year gain sp nears record high oil bond may beat sp treasury offer bang buck sp moving record territory here stockmarket investor know day moved u market stock market today dow sp live update december sp notch fresh year high rally compare recent year invesco sp pure growth etf rpg investing radar u market influence indian stock market mint dow land secondhighest close ever stock build eightweek winning streak,4774.75,0.9886
4422,2023-12-27,analyst really think dump stock year end reason buying stock sp close alltime high intels stock nearly tripled sp gain december stock market today sp near record high winter rally roll stock market news today stock drift higher sp inch toward record u stock inch higher sp near record high bond yield plunge ed yardeni reason youll see sp wall st ekes modest gain sp hovers near alltime closing high market news dec stock finish higher pushing dow new high sp still shy record dow close point higher wednesday sp hovers near record live update sp week winning streak could signal strong gain year ahead sp gain loss update model sends tesla share higher tech let sp continue streak stock market news today sp close new record high u stock market dow jones sp pc nasdaq climb bps equalweight sp handful key market gauge near golden cross stock market today dow sp live update december sp eye breakout recent high watch volatility index clue record share sp stock underperformed index weirdest bull market decade march dow jones post record close stock end mostly higher,4781.580078125,0.9742
4423,2023-12-28,dow score another alltime high sp remains shy record territory sp hit new alltime high here come next stock market today dow sp live update december sp fall slightly friday ride week win streak end gain live update wall street ekes modest gain sp hovers near alltime closing high market news dec sp edge toward alltime high dow hit another record yearend rally insurance stock outperformed sp ytd nasdaq index dow jones sp news bullish market trend sp nears record sp eye th week gain longest streak decade stock leading rally sp miss record stock market fade late small cap pace record december stock market news today sp stop shy alltime high stock market today new record high within reach sp sp could hit record year morgan stanley say stock market news today sp shy record high stock market today sp record sight treasury rally boost bull russell pace best december ever best month v sp year sp biggest winner analyst see going next year wall street strategist spoton sp forecast here outlook stock market news today sp sits within fraction record stock set final day roaring sp close little changed thursday struggle reach record live update take keep sp rally going sp etf spy approach b aum landmark,4783.35009765625,0.9872
4424,2023-12-29,wall street end slightly lower capping blockbuster year decadelong sp bull surge running valuation wall sp biggest gainer loser yearly sp chart paint compelling picture sp pop stock economy grow stock fool nearly everyone sp soaring nasdaq rising even formidable stock close gain buoyed resilient economy sp gain loss today uber get downgrade sp may rise fresh peak early january going bumpy first half stock say well sizzling magnificent seven trade keep powering u stock sp stock turn month wall st week ahead history show strong could keep u stock path gain sp biggest winner arent megacap ai play trader tenterhook sp open shy record close sp snapshot index end stock went gangbusters biggest winner loser sp consolidates u dollar yield recover sp could close record final trading day rare market event stock market today sp end slightly lower post gain worstperforming stock among sp sp ekes meager gain flirt bull market confirmation wall street strategist bull bear scenario u stock score gain sp log longest weekly winning streak since topperforming stock sp market news dec stock fall cap otherwise sunny year,4769.830078125,0.9886
4428,2024-01-02,stock market today dow sp live update january magnificent seven huge year near buy point investing sp uk know dividend etf beat sp wall street bull warns pause rally see sp grinding higher sp probable even conservative oppenheimer investingcom stock market today sp oil bitcoin elon musk china economy stock market gain could supercharged january trifecta outlook view watch across sp earnings ai bank modernas stock soar oppenheimer upgrade buy sp momentum report sp analysis happens week spx winning streak stock market week rally leaf sp overbought here good news analyst predict surprising new magnificent stock best worst performing sector official bestperforming sp stock nevertooearly forecast sp year u profit growth accelerate despite economy risk morning bid sp record view begin vein sp nasdaq begin lower close apple big tech weighs sp gain loss today tech stock slip start dow ekes new record close nasdaq end lower start sp close lower begin nasdaq notch worst day since october live update market news jan nasdaq sink apple loses b market cap bitcoin jump k,4742.830078125,0.9695
