,Date,Title,cp,Sentiment_Score
4301,2023-08-28,chart week sp asx hang seng index disney stock hit nineyear low here performance compare peer warren buffett bet fortune one cant lose stock nasdaq dow jones sp news nvidia tesla lead tech revival m surge boost dow sp outlook stock buyback rite aid stock experiencing extreme turbulence here market news aug nasdaq sp gain start week dow boosted future rise rally attempt face big question sp nasdaq end higher attempting beat back worst month since december sp gain loss today index add last week advance powell comment sell fundsmith equity buy dirt cheap sp tracker instead stock market today dow sp live update august nasdaq dow jones sp news market eye fed positive week start investor warning september sp worst performing month stock market rally long last forbes advisor openai launch version chatgpt business schwab sp index swppx strong mutual fund pick right sp nasdaq future continue rally jackson hole ai hype lift stock citigroup strategist scott chronert say spdr portfolio sp high dividend etf spyd investing radar dow close point higher wall street aim curtail august decline live update,4433.31005859375,0.7387
4302,2023-08-29,strategist say smart investor hang stock here nasdaq pop third straight winning day tech rebound august slump live update nasdaq dow jones sp news market wobble august final stretch sp end sharply higher job data fuel interest rate optimism sp gain loss today index gain job data boost hope rate hike pause good bad paccar inc mueller water product market news aug sp best day since june sign cooling labor market five sp stock buy watch today market stock market today dow sp live update august nasdaq dow jones sp news turbulent trade ahead key data release,4497.6298828125,0.9803
4303,2023-08-30,stock market outlook sp rally next month retest high gst fraud still run cop announce r k bounty con u equalweighted fund shine investor look beyond big tech sp rise fourth straight day major average curtail monthly loss late august hot streak live update sp gain loss today index rise thstraight day job gdp data market news aug nasdaq gain sp rise fourth straight day stock market indicator right time since sending bullish signal rising labor cost making ai stock even attractive market extend rally midday following job gdp report fund punished owning nvidia share stunning rally job opening dive sp rise key fed inflation rate test next first time since sp copper longer moving together tesla stock pull back sp leading rally previous session bestperforming stock past year investing u news wall street gain dollar softens weak data signal fed pause wall street end higher economic data fuel ratepause bet nasdaq index dow jones sp news slowing u economy boost hope rate hike pause stock market news today sp hit day win streak job data stock market today dow sp live update august sp could rally another yearend expert say offduty ranaghat asi emerges hero sp end sharply higher job data fuel interest rate optimism headandshoulders starting form sp nasdaq dow jones sp news upcoming key data could shift cautious market sentiment,4514.8701171875,0.9864
4304,2023-08-31,sp nasdaq post august loss breaking month winning streak dow close point higher kick september notch best week since july live update wall street end mixed inflation data buoy optimism stock market today dow sp live update september sp stock turn month morgan stanley andrew slimmon sp could rally countering mike wilson argument oppenheimer stoltzfus sticking bullish sp call sp gain loss today index end august little changed following inflation data dax sp cac see strength early trading nasdaq dow jones sp news salesforce shine amid slowing u economic growth u stock post losing month first nasdaq ahead august job report nasdaq ekes small gain thursday still suffers worst month live update fed new key inflation rate jumped sp rise sp path u pull soft landing nasdaq dow jones sp news looking end month positive note ahead nfp report stock market outlook wall street expects tough august market news aug nasdaq ekes gain sp dow break day winning streak,4507.66015625,0.9337
4305,2023-09-01,factor magnificent seven sp seasonality chart sends shiver spine september peculiar twist sp end higher job data fuel ratehike optimism blackstone airbnb set join sp share climb term week september effect analyst raising quarterly sp eps estimate first time since q airbnb blackstone join sp deere replace walgreens sp first trust launch active sp buffer etf top stock sp index weight september blackstone airbnb join sp index rebalancing spx stock rally loses steam sp snap month winning streak sp gain loss today index little changed unemployment jump sp black female ceo leave walgreens drugstore role nasdaq dow jones sp news eye u job data federal reserve signal august another month forget bearish investor drive stock job report solid hiring wage growth ebb near perfect sp waver dollar general downgraded raymond james analyst still see stock outperforming sp next year stock trader shrug high rate sp hitting best week since june august review outlook september worst month sp stock except uber could added sp next month mark mahaney sp outlook nfp propel u stock back yearly high time investor consider sector rotation amid techheavy sp trend shareholder proposal global market update u stock end mixed ahead job data mint,4515.77001953125,0.9822
4309,2023-09-05,u healthcare stock roiled investor tug war economy investor optimistic sp etf focus sp dead money stock likely blackstone mark another important milestone sp inclusion airbnb tesla stock rise manchester united softbank share fall stock move stock market today dow sp live update september fewer sp company discussing recession earnings call th straight quarter sp airbnb blackstone rally invite nasdaq dow jones sp news bearish response higher treasury yield china sluggish growth nasdaq dow jones sp news market tread lightly amid september historical woe thing know market open dow close nearly point lower rising oil price drag stock live update sp gain loss today index drop oil price interest rate rise market news sept stock close lower oil price surge saudi cut wall st slip treasury yield rise oil price boost energy sector pultegroup stock lead sp loser amid beatdown homebuilder sector treasury yield climb stock market exceptionally unlikely climb year record peak say stifels barry bannister airbnb blackstone share set price bump sp inclusion biden approval rating bounce thanks investor amid sp rally stock market news sep airbnb blackstone join sp sp giant servicenow lead stock bearing elite mark actionable sp headwind mount oil price rate u dollar head higher crowdstrikes surge sign cybersecurity revival concentration risk lurking k important driver stock price rise morning brief blackstone airbnb join sp,4496.830078125,0.8807
4310,2023-09-06,got per week stock market could turn sp gain loss today index drop amid renewed fear fed rate hike third sp stock get kicked nine year market news sept nasdaq sp tumble oil price continue climb stock market today dow sp live update september stock fall dollar yield u service data nasdaq dow jones sp news cautious pulse reverberates across wall street dow jones fall sp test key level economic data meta tesla back early entry u fund trust beaten sp since financial crisis dow tumble nearly point nasdaq fall third straight day fed rate hike fear return live update bmo say bull case scenario sp becoming likely gem doubled sp average return last year blackstone airbnb enter sp following rebalance avoid costly mistake market power failure solaredges value plummet billion year understanding sp index fund ramsey airbnb stock set join sp mean investor energy stock top sp sector august utility slide bottom nasdaq index dow jones sp news heightened inflation concern rattling investor confidence stock market outlook split forecaster often within wall street firm tsla tesla stock light sp leaderboard gain bright news stockmarket bull must defend line sand avert deeper slide analyst blackstone stock jump sp inclusion beginning,4465.47998046875,0.34
4311,2023-09-07,stock face highest risk getting booted sp ubs see end sp profit recession index june nasdaq dow jones sp news fed rate hike fear rattle u stock future sp gain loss today index slip worry rate hike tech energy etf outshining sp oil rally greg boutle bnp paribas raise sp yearend price target sp new downtrend still correction sp nasdaq fall apple drag jobless claim data fuel rate jitter stock market today sp target apple china yuan weakness arm ipo future sp break key level here stock could avoid steep selloff september stock market today dow sp live update september stock crash recession hit spring rosenberg time buy sp worstperforming august stock spdr sp etf trust nysearca spy hold pension trade bull market coming solid index fund made money like clockwork buy nasdaq tumble fourth day fear higher interest rate pressure market live update blackrock shift six etf full replication market news sept dow rise nasdaq fourday losing streak job data china iphone ban indicator show stock market overvalued since dotcom bubble crash,4451.14013671875,-0.9001
4312,2023-09-08,biggest stock market crash u history warren buffetts berkshire hathaway lose still outperformed sp sp close slightly ahead u inflation data sp snap day losing streak friday suffers first weekly decline three live update stock market news sep sp gain loss today index snap losing streak tech stock rise sp sector gaap earnings misleading trend continues q highest number sp company citing ai q earnings call year market news sept stock eke gain finish week lower ftse dax sp try stabilize tough week u stock end slightly higher sp snap threeday losing streak ahead next week inflation report u stock sp nasdaq fall apple drag jobless claim data fuel rate jitter market rise midday sp set break day losing streak tech rebound nasdaq dow jones sp news beijing move huaweis resurgence challenge apple dominance case owning stock bond crumbling sp form lower high elliott wave price forecast u company face much larger problem china apple smart money investor pour billion stock nasdaq dow jones sp news bracing rate hike uschina tension rattle tech stock nasdaq sp gap lower apple lead tech sector rout tech stock valuation creating significant divergence sp strategist,4457.490234375,-0.9176
4315,2023-09-11,market gain midday amid expectation fed might hike rate next meeting one company expected grow even faster nvidia sp sector roic keep falling q company improve workplace productivity invesco sp garp etf spgp investing radar sp tesla apple chipmaker lead big mover impressive outlier sp energy outperforms sector oil price surge big tech stock lead wall street stock higher nasdaq dow jones sp news inflation concern tech update steer market direction sp gain loss today index climb amid sign fed could pause rate increase sp dividend aristocrat list sorted analyst rating wall street bullish strategist warns choppiness stock still see sp touching record high year stock market today dow sp live update september dow jones nasdaq sp weekly preview goldman see choppy path equity near term investingcom sp may crash nearly severe recession hit economy berg,4487.4599609375,0.9231
4316,2023-09-12,airbnb join sp time buy low sp sector correlation welcome sign bull market according datatrek best sp stock dividend growth wall street end lower oracle tumble weak forecast sp tech stock slump apple event failing provide boost sector sp gain loss today index fall oil price hit high market news sept stock fall apple iphone release rising oil price nasdaq close lower tuesday apple slide tech suffers oracle shed live update magnificent seven dominate sp haunting echo dotcom bubble resurface westrock stock tear smurfit kappa deal sp look risky expensive could plunge something shock system morgan stanley stock market outlook bullish indicator signal new high ahead buying sp profitable following burry tweet expert fed meeting come historically tough week u stock socgen equity strategist upbeat sp nearterm cautious bofa survey show dramatic shift toward highflying u stock sp nasdaq fall midday oil price hit high look energy stock strength technology stock market today dow sp live update september market news sept nasdaq sp rise start week key inflation data nasdaq dow jones sp news oracle dip arm ipo reshape market landscape sp look risky may plunge something shock system wilson sp nasdaq set open red today oracle nyseorcl invesco qqq trust series n sp q buyback decline sector expenditure shift buyback tax reduced operating sp could surge bmos belski magnificent seven dominate sp haunting echo dotcom bubble resurface microsoft nasdaq investor buy stock september sell rest sp sector free cash flow yield stagnant q nasdaq dow jones sp news tesla tech giant lead ai hope else equal making case equalweight etf thermo fisher scientific stock recover preinflation shock high one year trudeaus bitcoin warning btc still beat inflation sp here warren buffetts favorite index fund could help make millionaire,4461.89990234375,0.9694
4317,2023-09-13,market news sept dow slip nasdaq gain core inflation accelerated august dow jump point best day since early august arm debut revives ipo market hope live update sp nasdaq gain treasury yield dip data firm fed pause bet stock rallied hot inflation data month ago dont expect repeat analyst say stock market today dow sp live update september ftse dax sp drop ahead u cpi stay upbeat u stock say socgen boosted sp target airbnb stock rise booking spot sp dow jones future fall sp struggle key level apple unveils iphone amundi continues shift ireland bn sp esg etf merge stock market rattled inflation data trucking stock get bounce look energy stock strength technology nasdaq sp gain treasury yield waver cpi cement fed pause apple investor already hate new iphone ever u stock close mostly higher despite inflation edging august sp sector pricetoeconomic book value ratio flat q index fund core cpi inflation picked august sp rising nasdaq dow jones sp news oil price soar tech stumble cpi loom jpmorgan say sp overvalued sp gain loss today index little changed inflation data sp end higher cpi data cement bet fed pause,4467.43994140625,0.9702
4318,2023-09-14,market news sept dow jump point sp rise arm debut awakens market wall street end higher economic data arm soar debut nasdaq dow jones sp news inflation fear ease retail sale surge dow jones future rise sp small cap key level titan near buy point sp economic earnings downward trend continues q stock market today dow sp live update september sp gain loss today index jump economic data arm ipo three reason september effect stock openmarkets first etf zeroday option etf launch u sp sell signal warning cap weight v equal weight divergence trillion triple witching option event rebalancing threaten market calm dividend aristocrat list stock market news sep hotel stock decline news hersha deal softened impact nasdaq dow jones sp news firm trade ahead ppi retail sale report arm ipo many etf buyer expert swapping typical sp tracker visualized long take double money,4505.10009765625,0.1779
4319,2023-09-15,u stock fall sp book another weekly loss amid worry inflation pressure auto worker strike market news sept sp nasdaq sink close volatile week trading medtech industry trend thriving next decade surefire warren buffett index fund could turn per month linking esg initiative financial performance arm share seen shooin nasdaq though sp unlikely nasdaq dow jones sp news tech titan stumble semiconductor woe shake u market legacy marketing group announces addition sp iq index use fias analyst optimistic rating sp company heading q dow shed nearly point friday sp nasdaq suffer second straight week loss live update warren buffetts sp housing market play surprised wall street sp u tech new alltime high march investingcom stock market today wall street close lower giving sp another losing week ftse dax sp rally improved sentiment sp gain loss today index slip consumer data tech loss dow industrials paying price leaving amazon alphabet wall street end sharply lower chipmakers megacaps slide wall st week ahead last fed hike tends aid stock doubt time five stock earnings set surge much company affected sp rebalancing close friday asx live asx leap sp rally broadly china data pending rtx corp stock recover preinflation shock high stock make richer magnificent analyst big part stock market unconvinced economy going anywhere weakness underneath hood,4450.31982421875,-0.0516
4322,2023-09-18,sp mark day without drop first time since lowest number sp company citing esg earnings call since q stockmarket strategist wall street raise yearend target here mint sp gain loss today index little changed ahead fed decision alphabet amazon included dow index dow jones nasdaq sp weekly preview stock drop friday investingcom nasdaq dow jones sp news investor jittery ahead fed decision rate stock market today dow sp live update september street earnings overstated sp q nasdaq dow jones sp news ticking higher following tech tumble amid fed speculation average stock market return past year sp forecast fed meeting instacart ipo top week calendar market news sept stock little changed start fed week strategist revising raising target sp,4453.52978515625,0.814
4323,2023-09-19,blackstone celebrated sp inclusion market news sept stock bond fall expectation higher longer rate stock market today dow sp live update september sp slump bottom bullish uptrend channel investor brace fed chair powell u dollar sp chart different path fed whats next usd spx u stock close lower investor take cover ahead fed decision sp october weakness yearend run ranked highest paid ceo sp pimcos browne see drop sp oil price shock sp gain loss today index fall new interest rate hike concern emerge sector breakdown board diversity sp company esg insight mint fed powell wont upset sp ceo succession practice russell sp firm hoard trillion cash looking big tech nasdaq dow jones sp news wall street edge ahead fed meeting,4443.9501953125,0.6467
4324,2023-09-20,sp another high price target here look wall street official stockmarket outlook spencer stuart u board index find sp boardroom prioritizing ceo experience financial expertise sp gain loss today index fall fed signal another rate hike year nasdaq dow jones sp news market surge investor eye fed next move powell remark bank america raise yearend sp price target say rally broaden bofa boost yearend target sp pointing ai benefit stock market today live update blackstone join rank sp nasdaq dow jones sp news stock future rise ahead federal reserve decision bank america lift sp end target led old economy stock stock market today dow sp live update september bank america strategist becomes latest wall street raise sp target bofas savita subramanian latest wall street lift sp target ftse dax sp try stabilize ahead fomc meeting wall street close lower fed hold rate steady warns higher longer u stock end lower fed leaf interest rate unchanged signal another rise possible bank america see upside stock despite fresh wave bear narrative stock market outlook bofa turned even bullish sp market news sept stock sink fed signal one rate hike higher longer u index ahead fed rate decision dow sp nasdaq price setup fed ratecut hope dim hawk take,4402.2001953125,0.9431
4325,2023-09-21,dow tumble point notch third day loss amid fear higher rate government shutdown sp analysis stock market correction may long way go buy sp next nothing free nightdragon diligent report find gap cyber experience sp board room u stock close lowest since june treasury yield spike hawkish fed stock market today dow sp live update september sp pace lowest close since june investor brace higher rate longer sp price forecast stock market plunge nasdaq dow jones sp news market stumble amid fed rate hike signal market news sept stock tumble second day fed higherforlonger signal sp dow jones remove thermal coal company sp esg index following consultation sp gain loss today index tumble following fed comment jobless claim u stock drop six month treasury yield surge,4330.0,-0.7271
4326,2023-09-22,sp test support russell break nasdaq bottom whats next investingcom stock market outlook falling job opening raise red flag sp dow slide point friday sp nasdaq post worst week since march fed update live update sp gain loss today index give gain amid concern higher rate market news sept sp slip cap worst week since march sp company find gap cybersecurity leadership insurance stock outperformed sp year sp nasdaq notch biggest weekly loss since march dow jones future rise sp undercut low tesla forge new buy point summer stock market notable winner loser industry analyst project increase sp price next month u stock end lower sp drop third straight week fed worry linger insurer got booted sp here buffetts best rule stock investing sp nasdaq frightening double double top nasdaq dow jones sp news fed rate stance shutdown fear rattle market wall st week ahead fedwary investor eye mounting risk u stock rally,4320.06005859375,-0.5719
4329,2023-09-25,sp bear pause bull stand firm mark critical battle line sp dow jones index cboe global market launch cboe sp dispersion index sp gain loss today index rally oil price drop ahead inflation data sp forecast next costco stock ahead q earnings nasdaq dow jones sp news investor brace extended fed rate hike sp top stock soar rest basically flat stock market today dow sp live update september analyst predict sp surge soon lifted stock zeroday option account sp option volume wall street post gain investor eye rate outlook cboe global market sp dow jones index launch cboe sp dispersion index september club stock defied sp recent slide sp price forecast stock set struggle sp still overvalued even correction here r invested start year jse top v sp,4337.43994140625,0.4767
4330,2023-09-26,sp gain loss today index plunge consumer confidence home sale fall hot big stock arent sp youll wish dow shed nearly point worst day since march economic worry return live update stock market outlook nobel winner robert shillers cape metric see sp heading dow sink point worst day since march interest rate fear roil market,4273.52978515625,-0.5938
4331,2023-09-27,fed higher longer message hit u stock bond wall street analyst expect sp rise next month favorite stock sp option quirk mint billion stirring manipulation talk cboe sp dispersion index dspx push hot option trade mainstream sp ekes slim gain investor weigh elevated yield government shutdown impact stock market possible effect explained whats driving u stock market return dow close lower wednesday stock comeback attempt fails live update u government shutdown would spare market heighten recession risk bitcoin price hold steady sp plunge day low david rosenberg investor economist playing fire sp gain loss today energy stock rise supply concern boost oil price buy highestpaying dividend stock sp stock market outlook sp headed new alltimehigh,4274.509765625,0.5574
4332,2023-09-28,dow sp book best day two week despite focus treasury market volatility jpmorgans kolanovic maintaining sp target sell offs veralto stock join sp kohl join sp smallcap spy stock buy right know world top index sp rise slightly thursday still pace worst month year live update stock market today dow sp live update september stock swooned september bluechip powerhouse etf buy investing u news wall street magnificent seven may mammoth liability stock market u government shutdown dont send market tanking coast far clear trader wary volatility jp morgan fund big option trade loom cboe launch sp dispersion index sp gain loss today index climb spending slows oil price drop,4299.7001953125,0.8323
4333,2023-09-29,market news sept sp dow fall index post first quarterly loss year stock suffer worst quarter good vibe dry sp suffered rough september worst still come wall street edge worst month year utility real estate sector drag sp q despite surging energy stock sp gain loss today index fall potential government shutdown loom federal reserve key inflation rate dived august sp falter treasury yield bounce sp suffers biggest monthly loss year u stock mostly drop inflation reading nasdaq dow jones sp news inflation data spur early market rise stock market news today sp close worst month dow shed point friday sp nasdaq wrap worst month live update october stock market stand high volatility aboveaverage return wall st week ahead u stock market powerhouse tested soaring bond yield sp could reach alltime high say jp morgan strategist top stock bet market climb wall worry chase sp nasdaq future point strong open today spdr select sector fund consumer discretionary sp slump bear market lingers october green red active trader commentary sp dip u inflation data ending weak third quarter sp future largely unchanged fed preferred gauge inflation cool fund may better sp retirement saver three u fund complement sp tracker nikkei ftse sp try recover month end warning sign suggest year stock market rally shaky leg sp stock turn month global etf beating sp first nine month equity even expensive bond oil gas stock topped sp return quarter crude price surged sp brushing mother trend line happens next could make break market nasdaq dow jones sp news rebounding amid treasury yield retreat recordhigh number sp company issuing eps guidance q,4288.0498046875,-0.9861
